{
    "response_types_supported": [
        "code",
        "token",
        "id_token"
    ],
    "request_parameter_supported": true,
    "grant_types_supported": [
        "implicit",
        "authorization_code",
        "refresh_token"
    ],
    "scopes_supported": [
        "openid"
    ],
    "issuer": "https://id.fudan.edu.cn/idp",
    "authorization_endpoint": "https://id.fudan.edu.cn/idp/authCenter/authenticate",
    "userinfo_endpoint": "https://id.fudan.edu.cn/idp/oidc/getUserInfo",
    "claims_supported": [
        "sub",
        "iss",
        "auth_time",
        "aud",
        "exp",
        "iat",
        "uid"
    ],
    "end_session_endpoint ": "https://id.fudan.edu.cn/idp/oidc/revokeToken",
    "jwks_uri": "https://id.fudan.edu.cn/idp/oidc/getPublicKey",
    "subject_types_supported": [
        "public"
    ],
    "id_token_signing_alg_values_supported": [
        "RS256",
        "ES256",
        "HS256"
    ],
    "token_endpoint": "https://id.fudan.edu.cn/idp/oidc/getOidcToken"
}
